{
  "format": "aiaeao.cube.resolution-result/1",
  "reference_version": "v9.4",
  "profile": "P1-VC/1.0.0",
  "component": "P1.3",
  "input_format": "acg_text",
  "input_sha256": "3010e0839bb2887c48effd290257404692b4ca6342843982434bc9d4ea3d817b",
  "context_id": null,
  "resolution_status": "FAIL",
  "checks": {
    "syntax": {
      "status": "PASS",
      "reason": "Source grammar parsed."
    },
    "structure": {
      "status": "PASS",
      "reason": "AST passed P1.2 structural checks."
    },
    "concept_resolution": {
      "status": "FAIL",
      "reason": "One or more references failed this stage."
    },
    "referent_binding": {
      "status": "NOT_EVALUATED",
      "reason": "No applicable references or blocked by earlier checks."
    },
    "predicate_typing": {
      "status": "NOT_EVALUATED",
      "reason": "Not implemented in P1.3; reserved for P1.4/P1.5."
    },
    "method_typing": {
      "status": "NOT_EVALUATED",
      "reason": "Not implemented in P1.3; reserved for P1.4/P1.5."
    },
    "qualifier_typing": {
      "status": "NOT_EVALUATED",
      "reason": "Not implemented in P1.3; reserved for P1.4/P1.5."
    },
    "scope_consistency": {
      "status": "NOT_EVALUATED",
      "reason": "Not implemented in P1.3; reserved for P1.4/P1.5."
    }
  },
  "bindings": [
    {
      "ast_path": "/",
      "home": "X",
      "layer": "α",
      "concept_key": "Σ",
      "referent_ref": "q",
      "concept_resolution": "FAIL",
      "referent_binding": "NOT_EVALUATED",
      "concept_id": "X:dimension:semantics",
      "instantiation": "not_instantiable"
    }
  ],
  "diagnostics": [
    {
      "code": "P1_NON_INSTANTIABLE",
      "stage": "concept_resolution",
      "severity": "error",
      "message": "X:dimension:semantics is a non-instantiable semantic dimension or relation viewpoint.",
      "reference_rule": "Morphology §2.9 D.5 / C012",
      "ast_path": "//address"
    }
  ],
  "epistemic_warrant": "NOT_EVALUATED",
  "current_authority": "NOT_EVALUATED",
  "canonical_admission": "NOT_EVALUATED",
  "semantic_typing": "NOT_EVALUATED",
  "limitations": [
    "P1.3-only status: predicate/method/qualifier/scope typing deferred.",
    "Context declarations are untrusted, including ζ witness pointers."
  ]
}
